[
 {
  "id": "ch-jc-001",
  "slug": "jc-boeuf-bourguignon",
  "title": "Boeuf Bourguignon",
  "genre": "french",
  "subgenre": "braises",
  "chef": {
   "name": "Julia Child",
   "slug": "julia-child"
  },
  "description": "Beef braised in Burgundy with lardons, pearl onions and mushrooms.",
  "difficulty": "advanced",
  "easeScore": 4,
  "spiceScore": 1,
  "popularity": 9,
  "pantryScore": 5,
  "servings": 6,
  "prepMin": 45,
  "cookMin": 210,
  "totalMin": 255,
  "equipment": [
   "oven",
   "stovetop"
  ],
  "ingredients": [
   "3 lb beef chuck, cut in 2-inch cubes",
   "6 oz bacon, cut in lardons",
   "2 tbsp olive oil",
   "1 carrot, sliced",
   "1 yellow onion, sliced",
   "2 tsp salt",
   "1 tsp black pepper",
   "2 tbsp all-purpose flour",
   "3 cups full-bodied red Burgundy",
   "2 cups beef broth",
   "1 tbsp tomato paste",
   "2 cloves garlic, mashed",
   "1/2 tsp dried thyme",
   "1 bay leaf",
   "18 pearl onions",
   "3 tbsp butter",
   "1 lb cremini mushrooms, quartered",
   "1/3 cup chopped parsley"
  ],
  "ingredientKeys": [
   "beef-chuck",
   "bacon",
   "olive-oil",
   "carrot",
   "yellow-onion",
   "salt",
   "black-pepper",
   "flour",
   "red-wine",
   "beef-broth",
   "tomato-paste",
   "garlic",
   "dried-thyme",
   "bay-leaf",
   "pearl-onions",
   "butter",
   "mushroom",
   "parsley"
  ],
  "specialty": [
   "beef-chuck",
   "red-wine",
   "pearl-onions"
  ],
  "steps": [
   "Simmer the lardons in water for 10 minutes, then drain and dry them. Blanching removes the smoky harshness so the bacon supports the wine rather than fighting it.",
   "Brown the lardons in the oil, lift them out, then pat the beef completely dry and brown it on all sides in batches. Dry meat and an uncrowded pan are the two conditions for browning - without them you steam the beef and lose everything.",
   "Brown the sliced carrot and onion, pour off the fat, then return the beef and lardons, season, and sprinkle the flour over. Toss and set the pot uncovered in a 450F oven for 4 minutes, toss again, and 4 minutes more. This sears the flour into a light crust that thickens the sauce.",
   "Lower the oven to 325F. Add the wine, enough broth to barely cover, the tomato paste, garlic, thyme and bay leaf. Bring to a simmer on the stovetop, cover, and braise 3 to 3 1/2 hours.",
   "Braise the pearl onions separately in butter and a little broth for 40 minutes, and sauté the mushrooms in butter over high heat until browned. Cooking them apart keeps each one distinct instead of dissolving into the stew.",
   "Strain the sauce, skim the fat, and reduce it until it coats a spoon. Combine everything, add the parsley, and serve with boiled potatoes or noodles."
  ],
  "diet": {
   "vegetarian": false,
   "vegan": false,
   "pescatarian": false,
   "glutenFree": false,
   "glutenFreeAdaptable": true,
   "dairyFree": false,
   "nutFree": true,
   "eggFree": true
  },
  "allergens": [
   "gluten",
   "dairy",
   "sulfites"
  ],
  "gmo": {
   "risk": "moderate",
   "sources": [
    "grain-fed-meat",
    "grain-fed-dairy"
   ]
  },
  "nutrition": {
   "calories": 782,
   "proteinG": 58,
   "carbsG": 22,
   "fiberG": 3,
   "sugarG": 8,
   "fatG": 44,
   "satFatG": 17,
   "sodiumMg": 1280,
   "cholesterolMg": 178
  },
  "tags": [
   "french",
   "project",
   "classic",
   "technique",
   "special-occasion",
   "make-ahead",
   "winter",
   "entertaining",
   "high-protein"
  ],
  "image": {
   "file": "jc-boeuf-bourguignon.jpg",
   "source": "commons-file",
   "match": "dish",
   "commonsFile": "Boeuf Bourguignon.JPG"
  }
 },
 {
  "id": "ch-jc-002",
  "slug": "jc-coq-au-vin",
  "title": "Coq au Vin",
  "genre": "french",
  "subgenre": "braises",
  "chef": {
   "name": "Julia Child",
   "slug": "julia-child"
  },
  "description": "Chicken braised in red wine with lardons, flamed with cognac.",
  "difficulty": "intermediate",
  "easeScore": 6,
  "spiceScore": 1,
  "popularity": 9,
  "pantryScore": 5,
  "servings": 6,
  "prepMin": 35,
  "cookMin": 75,
  "totalMin": 110,
  "equipment": [
   "stovetop"
  ],
  "ingredients": [
   "1 whole chicken (4 lb), cut in 8 pieces",
   "4 oz bacon, cut in lardons",
   "2 tbsp butter",
   "2 tsp salt",
   "1 tsp black pepper",
   "1/4 cup cognac",
   "3 cups young red wine",
   "2 cups chicken broth",
   "1 tbsp tomato paste",
   "3 cloves garlic, mashed",
   "1/2 tsp dried thyme",
   "1 bay leaf",
   "18 pearl onions",
   "3 tbsp butter, for the garnish",
   "1 lb cremini mushrooms, quartered",
   "3 tbsp all-purpose flour",
   "1/3 cup chopped parsley"
  ],
  "ingredientKeys": [
   "whole-chicken",
   "bacon",
   "butter",
   "salt",
   "black-pepper",
   "cognac",
   "red-wine",
   "chicken-broth",
   "tomato-paste",
   "garlic",
   "dried-thyme",
   "bay-leaf",
   "pearl-onions",
   "butter",
   "mushroom",
   "flour",
   "parsley"
  ],
  "specialty": [
   "whole-chicken",
   "cognac",
   "red-wine",
   "pearl-onions"
  ],
  "steps": [
   "Simmer the lardons in water 10 minutes, drain and dry, then brown them in the butter. Lift them out.",
   "Pat the chicken thoroughly dry, season, and brown it in the fat, skin-side down first, until golden on both sides.",
   "Pour the cognac over the chicken and flame it: stand back, touch a long match to the edge of the pan, and let it burn out on its own, shaking the pan. The flame burns off raw alcohol and leaves the cognac's depth behind.",
   "Add the wine, enough broth to almost cover, the tomato paste, garlic, thyme and bay leaf. Cover and simmer 25-30 minutes until the chicken is cooked through, then lift the pieces out.",
   "Braise the pearl onions in butter and broth 40 minutes and brown the mushrooms separately in butter. Cooking the garnishes apart is what keeps them intact.",
   "Skim the braising liquid and reduce it to about 2 cups. Mash the flour with 3 tbsp butter into a beurre manie and whisk it in bit by bit - this thickens the sauce at the end without lumps. Return everything, warm through, and finish with parsley."
  ],
  "diet": {
   "vegetarian": false,
   "vegan": false,
   "pescatarian": false,
   "glutenFree": false,
   "glutenFreeAdaptable": true,
   "dairyFree": false,
   "nutFree": true,
   "eggFree": true
  },
  "allergens": [
   "gluten",
   "dairy",
   "sulfites"
  ],
  "gmo": {
   "risk": "moderate",
   "sources": [
    "grain-fed-meat",
    "grain-fed-dairy"
   ]
  },
  "nutrition": {
   "calories": 712,
   "proteinG": 52,
   "carbsG": 22,
   "fiberG": 3,
   "sugarG": 9,
   "fatG": 42,
   "satFatG": 16,
   "sodiumMg": 1380,
   "cholesterolMg": 212
  },
  "tags": [
   "french",
   "classic",
   "technique",
   "special-occasion",
   "entertaining",
   "make-ahead",
   "winter",
   "high-protein"
  ],
  "image": {
   "file": "jc-coq-au-vin.jpg",
   "source": "commons-file",
   "match": "dish",
   "commonsFile": "Coq au vin 1.jpg"
  }
 },
 {
  "id": "ch-jc-003",
  "slug": "jc-sole-meuniere",
  "title": "Sole Meuniere",
  "genre": "french",
  "subgenre": "seafood",
  "chef": {
   "name": "Julia Child",
   "slug": "julia-child"
  },
  "description": "Sole dusted in flour, fried in butter, finished with lemon and parsley.",
  "difficulty": "beginner",
  "easeScore": 8,
  "spiceScore": 0,
  "popularity": 8,
  "pantryScore": 6,
  "servings": 2,
  "prepMin": 10,
  "cookMin": 12,
  "totalMin": 22,
  "equipment": [
   "stovetop"
  ],
  "ingredients": [
   "2 whole sole or 4 sole fillets",
   "1/2 cup whole milk",
   "1/2 cup all-purpose flour",
   "1 1/2 tsp salt",
   "1/2 tsp white pepper",
   "4 tbsp clarified butter",
   "4 tbsp butter",
   "2 tbsp lemon juice",
   "1/3 cup chopped parsley",
   "1 lemon, cut in wedges"
  ],
  "ingredientKeys": [
   "sole",
   "whole-milk",
   "flour",
   "salt",
   "white-pepper",
   "clarified-butter",
   "butter",
   "lemon-juice",
   "parsley",
   "lemon"
  ],
  "specialty": [
   "sole",
   "clarified-butter",
   "white-pepper"
  ],
  "steps": [
   "Meuniere means miller's wife, and the whole dish is named for its one essential step: a light dusting of flour.",
   "Dip the fish briefly in the milk, then dredge it in the seasoned flour and shake off every bit of excess. A heavy coating turns gummy; a bare whisper of flour is what browns.",
   "Use clarified butter for the frying. Whole butter has milk solids that burn at this heat, and clarified butter lets you get the pan properly hot.",
   "Fry the fish 2-3 minutes per side until golden, turning only once with a thin spatula. Sole is delicate and falls apart if handled twice.",
   "Move it to warm plates. Wipe the pan, add the whole butter, and cook it until it foams and turns light brown and smells nutty - 60-90 seconds, no more.",
   "Take the pan off the heat, add the lemon juice and parsley - it will hiss and foam - and pour it over the fish immediately. Serve with lemon wedges."
  ],
  "diet": {
   "vegetarian": false,
   "vegan": false,
   "pescatarian": true,
   "glutenFree": false,
   "glutenFreeAdaptable": false,
   "dairyFree": false,
   "nutFree": true,
   "eggFree": true
  },
  "allergens": [
   "gluten",
   "dairy",
   "fish"
  ],
  "gmo": {
   "risk": "low",
   "sources": [
    "grain-fed-dairy"
   ]
  },
  "nutrition": {
   "calories": 586,
   "proteinG": 38,
   "carbsG": 22,
   "fiberG": 1,
   "sugarG": 3,
   "fatG": 40,
   "satFatG": 24,
   "sodiumMg": 1180,
   "cholesterolMg": 178
  },
  "tags": [
   "french",
   "classic",
   "technique",
   "seafood",
   "pescatarian",
   "quick",
   "date-night",
   "restaurant-style"
  ],
  "image": {
   "file": "jc-sole-meuniere.jpg",
   "source": "commons-file",
   "match": "dish",
   "commonsFile": "Sole meuniere (4689490702).jpg"
  }
 },
 {
  "id": "ch-jc-004",
  "slug": "jc-french-omelette",
  "title": "French Omelette",
  "genre": "french",
  "subgenre": "breakfast",
  "chef": {
   "name": "Julia Child",
   "slug": "julia-child"
  },
  "description": "A pale, rolled omelette made in under a minute by shaking the pan.",
  "difficulty": "intermediate",
  "easeScore": 6,